<?xml version="1.0" encoding="UTF-8"?>
<!--Sample XML file generated by XMLSpy v2011 sp1 (http://www.altova.com)-->
<quickChat xsi:noNamespaceSchemaLocation="chatUsuarios.xsd" xmlns:xsi="http://www.w3.org/2001/XMLSchema-instance">
	<usuarios>
		<usuario>
			<nombre>String</nombre>
			<numeroTelefono>String</numeroTelefono>
			<mensajeEnviados>
				<mensaje>
					<mensajeID>text</mensajeID>
					<nombreUsuario>String</nombreUsuario>
					<textoMensaje>String</textoMensaje>
					<fechaPublicacion>1967-08-13</fechaPublicacion>
				</mensaje>
				<mensaje>
					<mensajeID>text</mensajeID>
					<nombreUsuario>String</nombreUsuario>
					<textoMensaje>String</textoMensaje>
					<fechaPublicacion>1967-08-13</fechaPublicacion>
				</mensaje>
				<mensaje>
					<mensajeID>text</mensajeID>
					<nombreUsuario>String</nombreUsuario>
					<textoMensaje>String</textoMensaje>
					<fechaPublicacion>1967-08-13</fechaPublicacion>
				</mensaje>
			</mensajeEnviados>
		</usuario>
		<usuario>
			<nombre>String</nombre>
			<numeroTelefono>String</numeroTelefono>
			<mensajeEnviados>
				<mensaje>
					<mensajeID>text</mensajeID>
					<nombreUsuario>String</nombreUsuario>
					<textoMensaje>String</textoMensaje>
					<fechaPublicacion>1967-08-13</fechaPublicacion>
				</mensaje>
				<mensaje>
					<mensajeID>text</mensajeID>
					<nombreUsuario>String</nombreUsuario>
					<textoMensaje>String</textoMensaje>
					<fechaPublicacion>1967-08-13</fechaPublicacion>
				</mensaje>
				<mensaje>
					<mensajeID>text</mensajeID>
					<nombreUsuario>String</nombreUsuario>
					<textoMensaje>String</textoMensaje>
					<fechaPublicacion>1967-08-13</fechaPublicacion>
				</mensaje>
			</mensajeEnviados>
		</usuario>
		<usuario>
			<nombre>String</nombre>
			<numeroTelefono>String</numeroTelefono>
			<mensajeEnviados>
				<mensaje>
					<mensajeID>text</mensajeID>
					<nombreUsuario>String</nombreUsuario>
					<textoMensaje>String</textoMensaje>
					<fechaPublicacion>1967-08-13</fechaPublicacion>
				</mensaje>
				<mensaje>
					<mensajeID>text</mensajeID>
					<nombreUsuario>String</nombreUsuario>
					<textoMensaje>String</textoMensaje>
					<fechaPublicacion>1967-08-13</fechaPublicacion>
				</mensaje>
				<mensaje>
					<mensajeID>text</mensajeID>
					<nombreUsuario>String</nombreUsuario>
					<textoMensaje>String</textoMensaje>
					<fechaPublicacion>1967-08-13</fechaPublicacion>
				</mensaje>
			</mensajeEnviados>
		</usuario>
	</usuarios>
	<chats>
		<chat>
			<uniqueID>String</uniqueID>
			<titulo>String</titulo>
			<ultimoMensaje>
				<mensajeID>text</mensajeID>
				<nombreUsuario>String</nombreUsuario>
				<textoMensaje>String</textoMensaje>
				<fechaPublicacion>1967-08-13</fechaPublicacion>
			</ultimoMensaje>
			<fechaCreacion>1967-08-13</fechaCreacion>
			<mensajes>
				<mensaje>
					<mensajeID>text</mensajeID>
					<nombreUsuario>String</nombreUsuario>
					<textoMensaje>String</textoMensaje>
					<fechaPublicacion>1967-08-13</fechaPublicacion>
				</mensaje>
				<mensaje>
					<mensajeID>text</mensajeID>
					<nombreUsuario>String</nombreUsuario>
					<textoMensaje>String</textoMensaje>
					<fechaPublicacion>1967-08-13</fechaPublicacion>
				</mensaje>
				<mensaje>
					<mensajeID>text</mensajeID>
					<nombreUsuario>String</nombreUsuario>
					<textoMensaje>String</textoMensaje>
					<fechaPublicacion>1967-08-13</fechaPublicacion>
				</mensaje>
			</mensajes>
			<mensajesArchivados>
				<mensaje>
					<mensajeID>text</mensajeID>
					<nombreUsuario>String</nombreUsuario>
					<textoMensaje>String</textoMensaje>
					<fechaPublicacion>1967-08-13</fechaPublicacion>
				</mensaje>
				<mensaje>
					<mensajeID>text</mensajeID>
					<nombreUsuario>String</nombreUsuario>
					<textoMensaje>String</textoMensaje>
					<fechaPublicacion>1967-08-13</fechaPublicacion>
				</mensaje>
				<mensaje>
					<mensajeID>text</mensajeID>
					<nombreUsuario>String</nombreUsuario>
					<textoMensaje>String</textoMensaje>
					<fechaPublicacion>1967-08-13</fechaPublicacion>
				</mensaje>
			</mensajesArchivados>
		</chat>
		<chat>
			<uniqueID>String</uniqueID>
			<titulo>String</titulo>
			<ultimoMensaje>
				<mensajeID>text</mensajeID>
				<nombreUsuario>String</nombreUsuario>
				<textoMensaje>String</textoMensaje>
				<fechaPublicacion>1967-08-13</fechaPublicacion>
			</ultimoMensaje>
			<fechaCreacion>1967-08-13</fechaCreacion>
			<mensajes>
				<mensaje>
					<mensajeID>text</mensajeID>
					<nombreUsuario>String</nombreUsuario>
					<textoMensaje>String</textoMensaje>
					<fechaPublicacion>1967-08-13</fechaPublicacion>
				</mensaje>
				<mensaje>
					<mensajeID>text</mensajeID>
					<nombreUsuario>String</nombreUsuario>
					<textoMensaje>String</textoMensaje>
					<fechaPublicacion>1967-08-13</fechaPublicacion>
				</mensaje>
				<mensaje>
					<mensajeID>text</mensajeID>
					<nombreUsuario>String</nombreUsuario>
					<textoMensaje>String</textoMensaje>
					<fechaPublicacion>1967-08-13</fechaPublicacion>
				</mensaje>
			</mensajes>
			<mensajesArchivados>
				<mensaje>
					<mensajeID>text</mensajeID>
					<nombreUsuario>String</nombreUsuario>
					<textoMensaje>String</textoMensaje>
					<fechaPublicacion>1967-08-13</fechaPublicacion>
				</mensaje>
				<mensaje>
					<mensajeID>text</mensajeID>
					<nombreUsuario>String</nombreUsuario>
					<textoMensaje>String</textoMensaje>
					<fechaPublicacion>1967-08-13</fechaPublicacion>
				</mensaje>
				<mensaje>
					<mensajeID>text</mensajeID>
					<nombreUsuario>String</nombreUsuario>
					<textoMensaje>String</textoMensaje>
					<fechaPublicacion>1967-08-13</fechaPublicacion>
				</mensaje>
			</mensajesArchivados>
		</chat>
		<chat>
			<uniqueID>String</uniqueID>
			<titulo>String</titulo>
			<ultimoMensaje>
				<mensajeID>text</mensajeID>
				<nombreUsuario>String</nombreUsuario>
				<textoMensaje>String</textoMensaje>
				<fechaPublicacion>1967-08-13</fechaPublicacion>
			</ultimoMensaje>
			<fechaCreacion>1967-08-13</fechaCreacion>
			<mensajes>
				<mensaje>
					<mensajeID>text</mensajeID>
					<nombreUsuario>String</nombreUsuario>
					<textoMensaje>String</textoMensaje>
					<fechaPublicacion>1967-08-13</fechaPublicacion>
				</mensaje>
				<mensaje>
					<mensajeID>text</mensajeID>
					<nombreUsuario>String</nombreUsuario>
					<textoMensaje>String</textoMensaje>
					<fechaPublicacion>1967-08-13</fechaPublicacion>
				</mensaje>
				<mensaje>
					<mensajeID>text</mensajeID>
					<nombreUsuario>String</nombreUsuario>
					<textoMensaje>String</textoMensaje>
					<fechaPublicacion>1967-08-13</fechaPublicacion>
				</mensaje>
			</mensajes>
			<mensajesArchivados>
				<mensaje>
					<mensajeID>text</mensajeID>
					<nombreUsuario>String</nombreUsuario>
					<textoMensaje>String</textoMensaje>
					<fechaPublicacion>1967-08-13</fechaPublicacion>
				</mensaje>
				<mensaje>
					<mensajeID>text</mensajeID>
					<nombreUsuario>String</nombreUsuario>
					<textoMensaje>String</textoMensaje>
					<fechaPublicacion>1967-08-13</fechaPublicacion>
				</mensaje>
				<mensaje>
					<mensajeID>text</mensajeID>
					<nombreUsuario>String</nombreUsuario>
					<textoMensaje>String</textoMensaje>
					<fechaPublicacion>1967-08-13</fechaPublicacion>
				</mensaje>
			</mensajesArchivados>
		</chat>
	</chats>
</quickChat>
